{
  "schema_version": 1,
  "step_id": "script",
  "round": 1,
  "artifact": "SCRIPT.md",
  "draft_hash": "bb00000000000000000000000000000000000000000000000000000000000000",
  "producer": { "provider": "text.openai", "model": "gpt-x" },
  "critic": { "provider": "text.claude", "model": "claude-y" },
  "objective_checks": [{ "id": "length", "pass": true }],
  "score": 7.5,
  "criteria": [{ "id": "hook", "score": 7, "weight": 0.5, "note": "mở đầu chậm" }],
  "issues": [{ "severity": "major", "location": "ln_2r7c4kxm", "text": "Thiếu bối cảnh" }],
  "tokens": { "input": 1200, "output": 800 },
  "cost_usd": 0.02,
  "created_at": "2026-10-03T10:50:00+07:00"
}
